{
  "schema_version": "1.0.0-draft",
  "programme_id": "SU-PUBLICATIONS-EUROPEPMC-v0.1",
  "status": "NONCANONICAL_PROGRAMME_CONTROL",
  "source_universe_id": "SU-PUBLICATIONS",
  "source_system": "EUROPE_PMC",
  "as_of": "2026-09-01",
  "provider_contract": {
    "provider": "Europe PMC",
    "api_endpoint": "https://www.ebi.ac.uk/europepmc/webservices/rest/search",
    "documentation": "https://europepmc.org/RestfulWebService",
    "query_parameter": "query",
    "format": "json",
    "result_type": "lite",
    "page_size": 1000,
    "pagination_mode": "CURSOR_MARK",
    "first_cursor_mark": "*",
    "next_cursor_field": "nextCursorMark",
    "reported_denominator_field": "hitCount",
    "synonym_expansion": false,
    "configuration_performs_http": false
  },
  "workbench_dependency": {
    "minimum_package_line": "0.3.0.dev0",
    "required_capability": "project_europepmc_search_pages",
    "integration_state": "NOT_IMPLEMENTED"
  },
  "identity_policy": {
    "preferred_identity_order": ["DOI", "PMID", "PMCID", "SOURCE_PLUS_EXT_ID"],
    "doi_normalization": "LOWERCASE_TRIMMED_DOI_WITHOUT_HTTPS_PREFIX",
    "pmid_normalization": "DECIMAL_STRING",
    "pmcid_normalization": "UPPERCASE_PMC_IDENTIFIER",
    "fallback_identity": "SOURCE_PLUS_EXT_ID",
    "fuzzy_title_identity_merge_allowed": false,
    "cross_query_deduplication": "EXACT_PREFERRED_RESOLVED_IDENTIFIER",
    "conflicting_same_identity_policy": "FAIL_CLOSED",
    "preprint_journal_version_auto_merge": false
  },
  "inclusion_policy": {
    "candidate_scope": "TITLE_OR_ABSTRACT_MATCH_UNDER_DECLARED_QUERY_STREAM",
    "automatic_publication_source_admission": false,
    "automatic_model_or_system_relationship_creation": false,
    "automatic_dataset_relationship_creation": false,
    "automatic_assessment_mutation": false,
    "automatic_monitor_creation": false,
    "human_relevance_review_required": true,
    "full_text_required_for_discovery": false
  },
  "known_identifier_anchors": [
    {
      "anchor_id": "EPMC-ANCHOR-PRIMA-001",
      "title": "Subretinal Photovoltaic Implant to Restore Vision in Geographic Atrophy Due to AMD",
      "doi": "10.1056/nejmoa2501396",
      "pmid": "41124203",
      "purpose": "Known clinical-neuroprosthesis publication used to test exact identifier continuity. Anchor retrieval never counts as new discovery.",
      "counts_as_new_discovery": false
    },
    {
      "anchor_id": "EPMC-ANCHOR-SPEECH-NEUROPROSTHESIS-001",
      "title": "An Accurate and Rapidly Calibrating Speech Neuroprosthesis",
      "doi": "10.1056/nejmoa2314132",
      "pmid": "39141853",
      "purpose": "Known intracortical speech-neuroprosthesis publication used to test exact identifier continuity. Anchor retrieval never counts as new discovery.",
      "counts_as_new_discovery": false
    }
  ],
  "query_streams": [
    {
      "query_id": "DISCOVERY-EPMC-BCI-001",
      "query_term": "TITLE_ABS:(\"brain-computer interface\" OR \"brain computer interface\" OR \"brain-machine interface\" OR \"brain machine interface\")",
      "cadence": "WEEKLY",
      "status": "ACTIVE",
      "scope_tiers": ["A"],
      "purpose": "High-precision explicit-interface vocabulary stratum.",
      "completeness_claim": false
    },
    {
      "query_id": "DISCOVERY-EPMC-NEURAL-DECODING-AI-001",
      "query_term": "TITLE_ABS:((neural OR brain OR cortical) AND (decoding OR decoder) AND (\"machine learning\" OR \"deep learning\" OR transformer OR \"foundation model\" OR \"artificial intelligence\"))",
      "cadence": "WEEKLY",
      "status": "ACTIVE",
      "scope_tiers": ["A"],
      "purpose": "AI-enabled neural-decoding stratum that does not require explicit BCI terminology.",
      "completeness_claim": false
    },
    {
      "query_id": "DISCOVERY-EPMC-INVASIVE-INTERFACE-AI-001",
      "query_term": "TITLE_ABS:((intracortical OR electrocorticography OR ECoG OR sEEG OR \"stereo-EEG\") AND (decoding OR interface OR prosthesis OR neuroprosthesis) AND (\"machine learning\" OR \"deep learning\" OR transformer OR algorithm OR \"artificial intelligence\"))",
      "cadence": "WEEKLY",
      "status": "ACTIVE",
      "scope_tiers": ["A"],
      "purpose": "Invasive neural-interface stratum for papers described by modality rather than BCI labels.",
      "completeness_claim": false
    },
    {
      "query_id": "DISCOVERY-EPMC-CLOSED-LOOP-NEUROMODULATION-001",
      "query_term": "TITLE_ABS:((\"deep brain stimulation\" OR neuromodulation OR neurostimulation OR stimulation) AND (adaptive OR \"closed-loop\" OR \"closed loop\") AND (algorithm OR classifier OR prediction OR \"machine learning\" OR \"artificial intelligence\"))",
      "cadence": "WEEKLY",
      "status": "ACTIVE",
      "scope_tiers": ["A"],
      "purpose": "Adaptive and closed-loop neuromodulation stratum, including algorithmic control papers not labelled NeuroAI.",
      "completeness_claim": false
    },
    {
      "query_id": "DISCOVERY-EPMC-EEG-FOUNDATION-001",
      "query_term": "TITLE_ABS:((EEG OR electroencephalography) AND (\"foundation model\" OR transformer OR \"self-supervised\" OR \"self supervised\" OR \"representation learning\"))",
      "cadence": "WEEKLY",
      "status": "ACTIVE",
      "scope_tiers": ["A", "B"],
      "purpose": "EEG representation/foundation-model stratum spanning direct models and enabling model infrastructure.",
      "completeness_claim": false
    },
    {
      "query_id": "DISCOVERY-EPMC-SPEECH-COMMUNICATION-001",
      "query_term": "TITLE_ABS:((brain OR neural OR cortical) AND (speech OR language OR communication) AND (decoder OR decoding OR prosthesis OR neuroprosthesis) AND (algorithm OR \"machine learning\" OR \"deep learning\" OR \"artificial intelligence\"))",
      "cadence": "WEEKLY",
      "status": "ACTIVE",
      "scope_tiers": ["A"],
      "purpose": "Communication-neuroprosthesis and neural speech/language decoding stratum.",
      "completeness_claim": false
    },
    {
      "query_id": "DISCOVERY-EPMC-VISUAL-NEUROPROSTHESIS-COMPUTATION-001",
      "query_term": "TITLE_ABS:((retinal OR retina OR visual OR \"visual cortex\") AND (prosthesis OR neuroprosthesis OR implant) AND (algorithm OR \"image processing\" OR \"machine learning\" OR \"artificial intelligence\"))",
      "cadence": "MONTHLY",
      "status": "ACTIVE",
      "scope_tiers": ["A", "B"],
      "purpose": "Visual and retinal neuroprosthesis stratum with explicit computational-role terms; inclusion still requires human review of the actual AI role.",
      "completeness_claim": false
    },
    {
      "query_id": "DISCOVERY-EPMC-GREY-MENTAL-STATE-001",
      "query_term": "TITLE_ABS:((EEG OR electroencephalography OR neural OR \"brain signal\") AND (attention OR emotion OR fatigue OR \"cognitive state\" OR \"mental state\") AND (classification OR prediction OR inference OR \"machine learning\" OR \"deep learning\" OR \"artificial intelligence\"))",
      "cadence": "MONTHLY",
      "status": "ACTIVE",
      "scope_tiers": ["C"],
      "purpose": "Grey-area discovery stratum for neural-derived inference of attention, emotion, fatigue, cognitive state or mental state. A match is a review candidate only.",
      "completeness_claim": false
    }
  ],
  "candidate_projection": {
    "required_fields": [
      "resolved_identity",
      "identity_type",
      "title",
      "publication_year",
      "author_string",
      "journal_or_source",
      "publication_type",
      "doi",
      "pmid",
      "pmcid",
      "source_plus_ext_id",
      "is_preprint",
      "query_memberships",
      "normalized_record_sha256"
    ],
    "raw_api_page_payloads_emitted_to_s2": false,
    "full_text_emitted_to_s2": false,
    "participant_level_data_emitted": false
  },
  "coverage_contract": {
    "required_metrics_per_query": [
      "supplied_page_count",
      "raw_returned_record_count",
      "unique_resolved_identity_count",
      "reported_hit_count_state",
      "reported_hit_count",
      "cursor_sequence_valid",
      "terminal_cursor_state",
      "reported_total_reconciliation_state",
      "known_anchor_count",
      "known_controlled_source_duplicate_count",
      "new_candidate_count",
      "cross_query_duplicate_representation_count",
      "unresolved_identity_count",
      "preprint_count",
      "peer_reviewed_or_journal_count"
    ],
    "mechanical_completion_requires": {
      "cursor_sequence_valid": true,
      "terminal_cursor_state": "TERMINAL",
      "reported_hit_count_state": "CONSISTENT",
      "reported_total_reconciliation_state": "MATCH"
    },
    "publication_database_completeness_claim": false,
    "global_neuroai_publication_recall_claim": false,
    "query_recall_claim": false,
    "mechanical_completion_semantics": "Mechanical completion means only that one exact configured Europe PMC query traversal is cursor-valid and reconciles its materialized unique-result denominator against the reported hitCount for that traversal. It does not establish exhaustive NeuroAI publication recall, relevance, evidence quality, or scientific truth."
  },
  "human_review_contract": {
    "required_dispositions": ["ACCEPT", "REJECT", "DEFER", "EXCLUDE"],
    "review_questions": [
      "Does the publication materially concern a NeuroAI-relevant system, model, dataset, neural interface, adaptive neurotechnology, or declared grey-area capability?",
      "Is the publication identity resolved without fuzzy title merging?",
      "Is the evidence state correctly distinguished among peer-reviewed article, preprint, correction/retraction, review, and other record type?",
      "What exact system/model/dataset relationship, if any, is supported by the publication?",
      "What inference is prohibited by this publication alone?"
    ],
    "automatic_acceptance": false
  },
  "network_policy": {
    "live_execution": "OPT_IN_ONLY",
    "requires_workbench_network_gate": true,
    "configuration_performs_http": false,